No,Title,Link,Polarity,Sentiment
1,"Highway developers get relief as govt tweaks cost escalation norms, speeds up payouts",https://www.businesstoday.in/latest/economy/story/highway-developers-get-relief-as-govt-tweaks-cost-escalation-norms-speeds-up-payouts-523842-2026-04-02,0,Neutral
2,"West Asia conflict pushes ₹100 products to ₹140, Tier 2, 3 markets face financial reset",https://www.businesstoday.in/latest/economy/story/west-asia-conflict-pushes-rs100-products-to-rs140-tier-2-3-markets-face-financial-reset-523835-2026-04-02,0,Neutral
3,"Centre exceeds indirect tax collection target for FY26, remains watchful for FY27",https://www.businesstoday.in/latest/economy/story/centre-exceeds-indirect-tax-collection-target-for-fy26-remains-watchful-for-fy27-523733-2026-04-02,0,Neutral
4,RBI tightens grip on forex market as Rupee faces renewed pressure,https://www.businesstoday.in/latest/economy/story/rbi-tightens-grip-on-forex-market-as-rupee-faces-renewed-pressure-523642-2026-04-02,0,Neutral
5,"India has 2 months of crude oil stock, no dry outs reported: Govt",https://www.businesstoday.in/india/story/india-has-2-months-of-crude-oil-stock-no-dry-outs-reported-govt-523542-2026-04-01,-0.333333333,Negative